{
  "unit_id": "A04",
  "title": "Math, projection, snapping utilities",
  "domain": "Data Model",
  "files_read": [
    {
      "path": "../probuilder-ref/Runtime/Core/Math.cs",
      "lines_total": 1316,
      "lines_read": "1-1316"
    },
    {
      "path": "../probuilder-ref/Runtime/Core/Projection.cs",
      "lines_total": 448,
      "lines_read": "1-448"
    },
    {
      "path": "../probuilder-ref/Runtime/Core/ProBuilderSnapping.cs",
      "lines_total": 97,
      "lines_read": "1-97"
    },
    {
      "path": "../probuilder-ref/Runtime/Core/TransformUtility.cs",
      "lines_total": 130,
      "lines_read": "1-130"
    },
    {
      "path": "../probuilder-ref/Runtime/Core/HandleUtility.cs",
      "lines_total": 579,
      "lines_read": "1-579"
    },
    {
      "path": "../probuilder-ref/Runtime/Core/Bounds2D.cs",
      "lines_total": 421,
      "lines_read": "1-421"
    },
    {
      "path": "../probuilder-ref/Runtime/Core/Clipping.cs",
      "lines_total": 130,
      "lines_read": "1-130"
    },
    {
      "path": "../probuilder-ref/Runtime/Core/IntVec2.cs",
      "lines_total": 73,
      "lines_read": "1-73"
    },
    {
      "path": "../probuilder-ref/Runtime/Core/IntVec3.cs",
      "lines_total": 76,
      "lines_read": "1-76"
    },
    {
      "path": "../probuilder-ref/Runtime/Core/IntVec4.cs",
      "lines_total": 79,
      "lines_read": "1-79"
    },
    {
      "path": "../probuilder-ref/Runtime/Core/VectorHash.cs",
      "lines_total": 80,
      "lines_read": "1-80"
    }
  ],
  "sections": [
    {
      "heading": "SNAPPING",
      "content": "ProBuilder provides a dedicated geometric snapping subsystem implemented across `ProBuilderSnapping` (runtime math) and `EditorSnapping` (editor settings and tool orchestration). Snapping operates in scalar, 3D vector, per-vertex, and ray-constrained modes.\n\n1. Scalar and Vector Snapping Algorithms:\n- `ProBuilderSnapping.Snap(float val, float snap)`: Evaluates whether `snap == 0`. If zero, returns `val` unmodified. Otherwise, computes `snap * Mathf.Round(val / snap)`, quantizing the value to the nearest integer multiple of `snap`.\n- `ProBuilderSnapping.Snap(Vector3 val, Vector3 snap)`: Quantizes each coordinate independently. Evaluates whether `Mathf.Abs(snap.x) > 0.0001f` (using a minimum epsilon threshold to ignore floating-point noise). If true, calculates `Snap(val.x, snap.x)`; otherwise leaves `val.x` unmodified. The same check applies to `val.y` and `val.z`.\n- `ProBuilderSnapping.SnapVertices(ProBuilderMesh mesh, IEnumerable<int> indexes, Vector3 snap)`: Snaps mesh vertices in world space. For every index in `indexes`, retrieves the local vertex position from `mesh.positionsInternal`, transforms it to world space via `mesh.transform.TransformPoint`, applies `Snap(worldPoint, snap)`, and converts the result back to local space using `mesh.transform.InverseTransformPoint`.\n- `ProBuilderSnapping.GetSnappingMaskBasedOnNormalVector(Vector3 normal)`: Generates a vector mask based on face orientation. For each axis (X, Y, Z), if `Mathf.Approximately(Mathf.Abs(normal[axis]), 1f)`, the mask component is set to `0f`; otherwise `1f`. This prevents snapping along the normal direction of an aligned surface while permitting snapping across the plane of the face.\n- `ProBuilderSnapping.IsCardinalDirection(Vector3 direction)`: Returns true if exactly one component is non-zero (`Mathf.Abs(direction[axis]) > 0f`) and the remaining two components are approximately zero (`Mathf.Approximately(direction[other], 0f)`).\n\n2. Ray Snapping Algorithm (`SnapValueOnRay`):\n- `ProBuilderSnapping.SnapValueOnRay(Ray ray, float distance, float snap, Vector3Mask mask)`: Determines the closest discrete grid snap point along a movement ray.\n  a. Initializes `nearest = k_MaxRaySnapDistance` (`Mathf.Infinity`).\n  b. Constructs `forwardRay = new Ray(ray.origin, ray.direction)` and `backwardsRay = new Ray(ray.origin, -ray.direction)`.\n  c. Iterates through the 3 primary axes (i = 0, 1, 2). If `mask[i] > 0f`:\n     - Creates axis mask `dir = new Vector3Mask((byte)(1 << i))`.\n     - Projects the movement ray vector `ray.direction * Math.MakeNonZero(distance)` onto `dir * Mathf.Sign(ray.direction[i])` using `Vector3.Project`.\n     - Computes projected point `pnt = ray.origin + prj` and creates a snapping plane: `plane = new Plane(dir, Snap(pnt, dir * snap))`.\n     - If `Mathf.Abs(plane.GetDistanceToPoint(ray.origin)) < 0.0001f`, sets `nearest = 0f` and continues.\n     - Raycasts `forwardRay` against `plane`; if intersection distance `d` satisfies `Mathf.Abs(d) < Mathf.Abs(nearest)`, updates `nearest = d`.\n     - Raycasts `backwardsRay` against `plane`; if intersection distance `d` satisfies `Mathf.Abs(d) < Mathf.Abs(nearest)`, updates `nearest = -d`.\n  d. Returns the snapped 3D position `ray.origin + ray.direction * (Mathf.Abs(nearest) >= k_MaxRaySnapDistance ? distance : nearest)`.\n\n3. ProGrids Integration and Snap Modes:\n- ProGrids integration operates through `ProGridsInterface`, a reflection bridge that probes for types `UnityEditor.ProGrids.ProGridsEditor`, `ProGrids.Editor.ProGridsEditor`, `ProGrids.Editor.pg_Editor`, `ProGrids.pg_Editor`, and `pg_Editor`.\n- Delegates bind to ProGrids methods: `s_ProGridsActiveDelegate`, `s_SnapEnabledDelegate`, `s_ProGridsSnapAsGroupDelegate`, `s_IsFullGridEnabledDelegate`, `s_GetActiveGridOffsetDelegate`, `s_SnapValueDelegate`, and `s_GetPivotDelegate`.\n- `ProBuilderEditor.PushToGrid(float snapVal)` subscribes to `ProGridsInterface.SubscribePushToGridEvent`. When triggered, it queries coincident vertices via `mesh.GetCoincidentVertices(mesh.selectedIndexesInternal)`, invokes `ProBuilderSnapping.SnapVertices(mesh, indexes, Vector3.one * snapVal)`, and calls `mesh.ToMesh()` followed by `mesh.Refresh()`.\n- `EditorSnapping.snapMode` resolves to:\n  - `SnapMode.Relative`: Active when `EditorSnapSettings.incrementalSnapActive` is enabled. Snapping increments are relative to the drag start.\n  - `SnapMode.World`: Active when `ProGridsInterface.SnapEnabled()` is true or when `EditorSnapSettings.gridSnapActive` is true and `Tools.pivotRotation == PivotRotation.Global`. Snaps directly to absolute world grid coordinates.\n  - `SnapMode.None`: Snapping is inactive.\n\n4. Element Snapping During Movement:\n- In `ProbuilderMoveTool` and `VertexManipulationTool`, element translation respects `EditorSnapping.snapAsGroup` (backed by user preference `ProBuilder.SnapSettings.s_SnapAsGroup`, default `true`, or ProGrids `GetSnapAsGroup()`):\n  - Group Snapping (`m_SnapAsGroup == true`): The tool calculates the global handle position, snaps the handle pivot to the grid via `ProBuilderSnapping.Snap` or `ProBuilderSnapping.SnapValueOnRay`, and applies the resulting delta uniformly to all selected vertices/faces/edges. This preserves relative offsets between elements.\n  - Individual Snapping (`m_SnapAsGroup == false`): When `EditorSnapping.snapMode == SnapMode.World`, each vertex is transformed to world space (`wp`), snapped individually to the grid via `ProBuilderSnapping.Snap(wp, snapValue)` (or along constrained single axes with `SnapValueOnRay`), and converted back to model space using `worldToLocal.MultiplyPoint3x4(snap)`.",
      "source_evidence": [
        {
          "file": "../probuilder-ref/Runtime/Core/ProBuilderSnapping.cs",
          "line_range": "10-18",
          "quote": "        const float k_MaxRaySnapDistance = Mathf.Infinity;\n\n        internal static bool IsCardinalDirection(Vector3 direction)\n        {\n            return\n                Mathf.Abs(direction.x) > 0f && Mathf.Approximately(direction.y, 0f) && Mathf.Approximately(direction.z, 0f)\n                || Mathf.Abs(direction.y) > 0f && Mathf.Approximately(direction.x, 0f) && Mathf.Approximately(direction.z, 0f)\n                || Mathf.Abs(direction.z) > 0f && Mathf.Approximately(direction.x, 0f) && Mathf.Approximately(direction.y, 0f);\n        }"
        },
        {
          "file": "../probuilder-ref/Runtime/Core/ProBuilderSnapping.cs",
          "line_range": "20-47",
          "quote": "        public static float Snap(float val, float snap)\n        {\n            if (snap == 0)\n                return val;\n\n            return snap * Mathf.Round(val / snap);\n        }\n\n        public static Vector3 Snap(Vector3 val, Vector3 snap)\n        {\n            return new Vector3(\n                (Mathf.Abs(snap.x) > 0.0001f) ? Snap(val.x, snap.x) : val.x,\n                (Mathf.Abs(snap.y) > 0.0001f) ? Snap(val.y, snap.y) : val.y,\n                (Mathf.Abs(snap.z) > 0.0001f) ? Snap(val.z, snap.z) : val.z\n            );\n        }\n\n        /// <summary>\n        /// Snap all vertices to an increment of @snapValue in world space.\n        /// </summary>\n        /// <param name=\"mesh\"></param>\n        /// <param name=\"indexes\"></param>\n        /// <param name=\"snap\"></param>\n        public static void SnapVertices(ProBuilderMesh mesh, IEnumerable<int> indexes, Vector3 snap)\n        {\n            Vector3[] verts = mesh.positionsInternal;\n\n            foreach (var v in indexes)"
        },
        {
          "file": "../probuilder-ref/Runtime/Core/ProBuilderSnapping.cs",
          "line_range": "49-65",
          "quote": "        }\n\n        internal static Vector3 GetSnappingMaskBasedOnNormalVector(Vector3 normal)\n        {\n            return new Vector3(\n                (Mathf.Approximately(Mathf.Abs(normal.x), 1f)) ? 0f : 1f,\n                (Mathf.Approximately(Mathf.Abs(normal.y), 1f)) ? 0f : 1f,\n                (Mathf.Approximately(Mathf.Abs(normal.z), 1f)) ? 0f : 1f);\n        }\n\n        internal static Vector3 SnapValueOnRay(Ray ray, float distance, float snap, Vector3Mask mask)\n        {\n            var nearest = k_MaxRaySnapDistance;\n\n            var forwardRay = new Ray(ray.origin, ray.direction);\n            var backwardsRay = new Ray(ray.origin, -ray.direction);\n"
        },
        {